id,year,venue,out_d,in_d,title
573697036e3b12023e5fd887,2009,ICFP,1,0,Automatically RESTful web applications: marking modular serializable continuations.
573697036e3b12023e5fd889,2010,ICFP,1,0,Logical types for untyped languages.
573697036e3b12023e5fd895,2011,ICFP,1,0,Towards a comprehensive theory of monadic effects.
573697036e3b12023e5fd896,2015,ICFP,1,0,Noninterference for free.
573697036e3b12023e5fd8ce,2011,ICFP,1,0,Implicit self-adjusting computation for purely functional programs.
573697036e3b12023e5fd8cf,2013,ICFP,1,0,Optimizing abstract abstract machines.
573697036e3b12023e5fd8d0,2008,ICFP,1,0,Deciding kCFA is complete for EXPTIME.
573697036e3b12023e5fd8e4,2005,ICFP,1,0,The anatomy of a loop: a story of scope and control.
573697036e3b12023e5fd902,2010,ICFP-WGP,1,0,Scrap your zippers: a generic zipper for heterogeneous types.
573697036e3b12023e5fd90f,1999,ICFP,1,0,Atomic Heap Transactions and Fine-grain Interrupts.
573697036e3b12023e5fd93e,2007,ICFP,1,0,Inductive reasoning about effectful data types.
573697036e3b12023e5fdcc0,2015,WiOpt,1,0,"Design, architecture and implementation of a resource discovery, reservation and provisioning framework for testbeds."
573697066e3b12023e6003ae,2013,CRIWG,1,0,OurMap: Representing Crowdsourced Annotations on Geospatial Coordinates as Linked Open Data.
573697066e3b12023e600811,2003,LPAR,1,0,Computable Numberings.
573697076e3b12023e60113b,2003,IICAI,1,0,Introducing Lifetime Parameter in Selection Based Particle Swarm Optimization for Improved Performance.
573697076e3b12023e6016c6,2015,KSE,1,0,Using Hand Postures for Interacting with Assistant Robot in Library.
573697076e3b12023e6018f8,2011,IFIP Int. Conf. Digital Forensics,1,0,Router and Interface Marking for Network Forensics.
573697096e3b12023e6027e6,1989,IJCAI,2,0,Simulating Student Programmers.
573697096e3b12023e603222,2011,IJCAI,1,0,Backdoors to Tractable Answer-Set Programming.
573697096e3b12023e6035ab,1973,IJCAI,1,0,A Procedure for Adaptive Control of the Interaction Between Acoustic Classification and Linguistic Decoding in Automatic Recognition of Continuous Speech.
573697096e3b12023e60380e,1995,Learning for Natural Language Processing,1,0,Using hybrid connectionist learning for speech/language analysis.
573697096e3b12023e603961,1993,IJCAI,1,0,AI Multimedia and Education.
5736970a6e3b12023e60463c,2011,DASC,1,0,Pervasive Intelligent Routing in Content Centric Delay Tolerant Networks.
5736970b6e3b12023e604c54,2006,ICWS,1,0,A Mixed Initiative Approach to Semantic Web Service Discovery and Composition: SAP's Guided Procedures Framework.
5736970c6e3b12023e6054f0,2005,DAIS,1,0,Loosely-Coupled Integration of CSCW Systems.
5736970c6e3b12023e6057db,2015,Big Data,1,0,Cost and data exploration considerations for big data prediction on the cloud.
5736970c6e3b12023e605864,2013,IVCNZ,1,0,Texture modelling with generic translation- and contrast/offset-invariant 2nd-4th-order MGRFs.
5736970c6e3b12023e605869,2012,IVCNZ,1,0,The Ngongotaha river UDPS experiment: low-cost underwater dynamic stereo photogrammetry.
5736970d6e3b12023e606587,2003,Networked Group Communication,1,0,Enhancing Peer-to-Peer Parallel Data Access with PeerFecT.
5736970d6e3b12023e606952,1998,TREC,1,0,Experiments in Spoken Document Retrieval at CMU.
5736970e6e3b12023e606cb5,1999,TREC,1,0,The Weaver System for Document Retrieval.
5736970e6e3b12023e606e5a,2011,ReTIS,1,0,Application of knowledge based decision technique to predict student enrollment decision.
5736970e6e3b12023e606e6d,2015,ReTIS,1,0,Fast and efficient compressive sensing for wideband Cognitive Radio systems.
5736970e6e3b12023e60710c,2001,CoopIS,1,0,Schema Design and Query Processing in a Federated Multimedia Database System.
5736970e6e3b12023e607622,2008,FGCN (1),1,0,Barycentric Location Estimation for Indoors Localization in Opportunistic Wireless Networks.
5736970f6e3b12023e607832,2010,SIN,1,0,Trust based multi-path routing for end to end secure data delivery in manets.
5736970f6e3b12023e6078f7,2012,SIN,1,0,An efficient fuzzy controller based technique for network traffic classification to improve QoS.
5736970f6e3b12023e60838d,1992,NOSSDAV,1,0,Basic Synchronization Concepts in Multimedia Systems.
5736970f6e3b12023e608660,2009,ISMM,1,0,Precise garbage collection for C.
5736970f6e3b12023e608667,2008,ISMM,1,0,Memory management for self-adjusting computation.
573697106e3b12023e6092f7,1978,ICSE,1,0,Design and Verification of Communication Procedures: A Bottom-Up Approach.
573697106e3b12023e609555,2014,WETSoM,1,0,A new metric for predicting software change using gene expression programming.
573697106e3b12023e609700,2007,ICSE,1,0,A Leveled Examination of Test-Driven Development Acceptance.
573697106e3b12023e60973e,2014,SER&IPs,1,0,Making sense of academia-industry gap in the evolving cloud service brokerage.
573697106e3b12023e609781,2013,ICSE,1,0,An evaluation of interactive test-driven labs with WebIDE in CS0.
573697126e3b12023e609cef,2014,SBST,1,0,Search based techniques for software fault prediction: current trends and future directions.
573697126e3b12023e609dc1,2014,MOBILESoft,1,0,Refactoring local to cloud data types for mobile apps.
573697126e3b12023e609e8c,2002,ICSE,1,0,"Advanced control flows for flexible graphical user interfaces: or, growing GUIs on trees or, bookmarking GUIs."
573697136e3b12023e60a91f,2014,ITNG,1,0,Analysis of Data Mining Techniques for Software Effort Estimation.
573697136e3b12023e60aa7d,2009,ITNG,1,0,Evaluating Test-Driven Development in an Industry-Sponsored Capstone Project.
573697136e3b12023e60ab70,2013,ITNG,1,0,Delineation of ECG Wave Components Using K-Nearest Neighbor (KNN) Algorithm: ECG Wave Delineation Using KNN.
573697136e3b12023e60acd4,2009,ITNG,1,0,Design Patterns Go to Hollywood: Teaching Patterns with Multimedia.
573697136e3b12023e60ace1,2006,ITNG,1,0,Measurement of Intra-Class & Inter-Class Weakness for Object-Oriented Software.
573697146e3b12023e60b5c6,2015,AIR,1,0,Comparative kinematic and dynamic performance analysis of planar parallel manipulators.
573697146e3b12023e60b5c9,2015,AIR,1,0,A robust task space position tracking control of an underwater vehicle manipulator system.
573697166e3b12023e60cf6e,2008,ICRA,1,0,Optimal trajectory generation for a glider in time-varying 2D ocean flows B-spline model.
573697176e3b12023e60d85c,2011,ICRA,1,0,Real-time volume estimation of a dragline payload.
5736971a6e3b12023e60f679,2007,PerCom Workshops,1,0,UbiStore: Ubiquitous and Opportunistic Backup Architecture.
5736971c6e3b12023e610895,2000,HSCC,1,0,Decidability and Complexity Results for Timed Automata and Semi-linear Hybrid Automata.
5736971d6e3b12023e6111ee,2001,DNA,1,0,DNA-based Parallel Computation of Simple Arithmetic.
5736971d6e3b12023e611235,2002,DNA,1,0,Implementation of a Random Walk Method for Solving 3-SAT on Circular DNA Molecules.
5736971d6e3b12023e611888,2012,HRI,1,0,"Design, integration, and test of a shopping assistance robot system."
5736971e6e3b12023e612581,2011,HIS,1,0,Metropolis algorithm for solving shortest lattice vector problem (SVP).
5736971e6e3b12023e612594,2008,HIS,1,0,Memetic Algorithms for Feature Selection in Face Recognition.
5736971f6e3b12023e61275f,1998,FM-Trends,1,0,Design of Distributed Multimedia Applications (DAMD).
5736971f6e3b12023e612cce,1995,FTDCS,1,0,Specification and Validation of Multimedia Protocols using RT-LOTOS.
5736971f6e3b12023e612d2b,1995,FTDCS,1,0,Fragmentation of confidential objects for data processing security in distributed systems.
5736971f6e3b12023e61316d,2007,ICECCS,1,0,"EmVC: Managing Changes and Configurations in Designs of Complex, Embedded Computing Systems."
573697206e3b12023e613cd7,2004,GI Jahrestagung (2),1,0,Data Management Issues in Disconnected Sensor Networks.
573697206e3b12023e613d5e,1997,GI Jahrestagung,1,0,"33. Workshop ""Komplexittstheorie, Datenstrukturen und Effiziente Algorithmen""."
573697216e3b12023e613eb9,1998,"Workshop Multimedia-Systeme, GI Jahrestagung",1,0,Entwicklung und Einsatz einer Videodatendank im WWW - ein Erfahrungsbericht.
573697216e3b12023e6140b1,1981,GI Jahrestagung,1,0,Relating Uniform and Nonuniform Models of Computation.
573697216e3b12023e614237,2009,GI Jahrestagung,1,0,A Game-Theoretic Model for Distributed Programming by Contract.
573697216e3b12023e61436c,1990,GI Jahrestagung (1),1,0,Wende zur Phantasie: Zur Theoriebildung in der Informatik.
573697216e3b12023e61469c,2005,IWAN,1,0,A Programmable Structured Peer-to-Peer Overlay.
573697226e3b12023e614cb4,2013,IPEC,1,0,The Parameterized Complexity of Fixpoint Free Elements and Bases in Permutation Groups.
573697226e3b12023e615184,1994,HPN,1,0,Implementing Intra-Stream Synchronization by Means of Conditional Dependency Expressions.
573697226e3b12023e6151e5,1990,SIGAL International Symposium on Algorithms,1,0,Algorithms from Complexity Theory: Polynominal-Time Operations for Complex Sets.
573697226e3b12023e6151f4,1990,SIGAL International Symposium on Algorithms,1,0,Complexity Cores and Hard Problem Instances.
573697226e3b12023e615204,1990,SIGAL International Symposium on Algorithms,1,0,Structural Analyses on the Complexity of Inverting Functions.
573697256e3b12023e61711f,2010,SMC,1,0,Spatio-temporal salience based video quality assessment.
573697256e3b12023e617910,2015,SMC,1,0,An Event Driven Approach for Integrating Multi-sensory Effects to Interactive Environments.
573697256e3b12023e617cea,2010,SMC,1,0,A tutorial for applying DMOC to solve optimization control problems.
573697266e3b12023e618c13,2003,Multimedia Information Systems,1,0,RSV-Transfer: An Algorithm for Similarity Queries on Structured Documents.
573697266e3b12023e618c77,2001,Multimedia Information Systems,1,0,An End User Retrieval Interface for Structured Multimedia Documents.
573697276e3b12023e6192a3,2008,APPROX-RANDOM,1,0,Derandomizing the Isolation Lemma and Lower Bounds for Circuit Size.
573697276e3b12023e6193cc,2010,APPROX-RANDOM,1,0,Uniform Derandomization from Pathetic Lower Bounds.
573697276e3b12023e61968e,2000,FSTTCS,1,0,Is the Standard Proof System for SAT P-Optimal?
573697276e3b12023e6196b4,1992,FSTTCS,1,0,"On Bounded Truth-Table, Conjunctive, and Randomized Reductions to Sparse Sets."
573697276e3b12023e6196e2,2008,FSTTCS,1,0,3-connected Planar Graph Isomorphism is in Log-space.
573697276e3b12023e619702,1998,FSTTCS,1,0,On the Complexity of Counting the Number of Vertices Moved by Graph Automorphisms.
573697276e3b12023e619703,1988,FSTTCS,1,0,"Padding, Commitment and Self-reducability."
573697276e3b12023e619709,1992,FSTTCS,1,0,Structural Average Case Complexity.
573697276e3b12023e61970f,1989,FSTTCS,1,0,On the Limitations of Locally Robust Positive Reductions.
573697276e3b12023e619744,2010,FSTTCS,1,0,Colored Hypergraph Isomorphism is Fixed Parameter Tractable.
573697276e3b12023e6197aa,2012,FSTTCS,1,0,Solving the Canonical Representation and Star System Problems for Proper Circular-Arc Graphs in Logspace.
573697276e3b12023e61983d,2010,FSTTCS,1,0,Graph Isomorphism is not AC^0 reducible to Group Isomorphism.
573697276e3b12023e6198c0,2007,FSTTCS,1,0,Reductions to Graph Isomorphism.
573697276e3b12023e6198fb,1995,FSTTCS,1,0,Average Polynominal Time Is Hard for Exponential Time Under sn-Reductions.
573697276e3b12023e61990c,1999,FSTTCS,1,0,Graph Isomorphism: Its Complexity and Algorithms (Abstract).
573697276e3b12023e61999b,1987,FSTTCS,1,0,On Certain Bandwidth Restricted Versions of the Satisfaiability Problem of Propositional CNF Formulas.
573697276e3b12023e6199e7,1991,FSTTCS,1,0,On the Structure and Complexity of Infinite Sets with Minimal Perfect Hash Functions.
573697276e3b12023e619a08,2000,FSTTCS,1,0,On Distribution-Specific Learning with Membership Queries versus Pseudorandom Generation.
573697276e3b12023e619a93,2009,FSTTCS,1,0,Arithmetic Circuits and the Hadamard Product of Polynomials.
573697276e3b12023e619a98,2008,FSTTCS,1,0,Some Sieving Algorithms for Lattice Problems.
573697276e3b12023e619acc,2009,FSTTCS,1,0,"Graph Isomorphism for K_{3, 3}-free and K_5-free graphs is in Log-space."
573697276e3b12023e619ae9,1997,FSTTCS,1,0,On Resource-Bounded Measure and Pseudorandomness.
573697286e3b12023e619cc7,2009,CCCG,1,0,A Comparison of Two Fully-Dynamic Delaunay Triangulation Methods.
5736972b6e3b12023e61cd21,2006,OOPSLA Companion,1,0,Interlanguage migration: from scripts to programs.
5736972b6e3b12023e61cd96,2013,OOPSLA,1,0,Option contracts.
5736972b6e3b12023e61ce62,2005,OOPSLA Companion,1,0,Software architecture improvement through test-driven development.
5736972b6e3b12023e61cf07,2010,SPLASH/OOPSLA Companion,1,0,Object-oriented software considerations in airborne systems and equipment certification.
5736972b6e3b12023e61cfe2,2010,OOPSLA,1,0,"Random testing for higher-order, stateful programs."
5736972b6e3b12023e61d05a,2001,OOPSLA,1,0,Regression Test Selection for Java Software.
5736972b6e3b12023e61d072,2011,OOPSLA,1,0,Flow-sensitive type recovery in linear-log time.
5736972b6e3b12023e61d0a0,2012,OOPSLA,1,0,Chaperones and impersonators: run-time support for reasonable interposition.
5736972b6e3b12023e61d0bb,2010,OOPSLA,1,0,The two-state solution: native and serializable continuations accord.
5736972b6e3b12023e61d120,2012,OOPSLA,1,0,Gradual typing for first-class classes.
5736972b6e3b12023e61d163,2015,OOPSLA,1,0,Galois transformers and modular abstract interpreters: reusable metatheory for program analysis.
5736972b6e3b12023e61d250,2003,OOPSLA Companion,1,0,Implications of test-driven development: a pilot study.
5736972b6e3b12023e61d493,2015,OOPSLA,1,0,Incremental computation with names.
5736972b6e3b12023e61d4e1,2011,OOPSLA,1,0,Self-adjusting stack machines.
5736972b6e3b12023e61d4f5,2012,OOPSLA,1,0,Optimization coaching: optimizers learn to communicate with programmers.
5736972b6e3b12023e61d60a,2005,OOPSLA Companion,1,0,Software architecture improvement through test-driven development.
5736972c6e3b12023e61d76a,2012,OOPSLA,1,0,Higher-order symbolic execution via contracts.
5736972c6e3b12023e61dc3d,2004,VLDB,1,0,QStream: Deterministic Querying of Data Streams.
5736972c6e3b12023e61dd5b,2005,VLDB,1,0,"REED: Robust, Efficient Filtering and Event Detection in Sensor Networks."
5736972d6e3b12023e61e309,2004,VLDB,1,0,An Integration Framework for Sensor Networks and Data Stream Management Systems.
5736972d6e3b12023e61ea76,1999,INFOVIS,1,0,A Java-Based Visual Mining Infrastructure and Applications.
5736972d6e3b12023e61eca5,2008,ROBIO,1,0,Robust real-time landmark recognition for humanoid robot navigation.
5736972f6e3b12023e61fe1a,2007,WABI,1,0,Seeded Tree Alignment and Planar Tanglegram Layout.
5736972f6e3b12023e61fedd,2003,WABI,1,0,A Stochastic Approach to Count RNA Molecules Using DNA Sequencing Methods.
573697306e3b12023e620f2f,2010,IJCAR,1,0,Beluga: A Framework for Programming and Reasoning with Deductive Systems (System Description).
573697316e3b12023e62169a,1987,ICPP,1,0,Estimating Interlock and Improving Balance for Pipelined Architectures.
573697316e3b12023e6216ff,1994,ICPP (3),1,0,Message-Task Scheduling in Object-Oriented Heterogeneous GURU Distributed DBMS.
573697316e3b12023e62191f,1985,ICPP,1,0,Computing Tree Functions on Mesh-Connected Computers.
573697316e3b12023e621b09,1986,ICPP,1,0,Parallel Approximate Algorithms for the 0-1 Knapsack Problem.
573697316e3b12023e621b29,1986,ICPP,1,0,A Parallel Algorithm for Dominators.
573697316e3b12023e621ff0,1985,ICPP,1,0,An Efficient Connected Components Algorithm on a Mesh-Connected Computer.
573697316e3b12023e622889,2004,ICTAI,1,0,Ontology Based Object Learning and Recognition: Application to Image Retrieval.
573697326e3b12023e622bad,1991,ICTAI,1,0,A heuristic search strategy for optimization of trade-off cost measures.
573697326e3b12023e6232c5,2006,AIRS,1,0,Concept Propagation Based on Visual Similarity.
573697326e3b12023e6232e4,2013,AIRS,1,0,Serendipitous Recommendation for Mobile Apps Using Item-Item Similarity Graph.
573697336e3b12023e623594,2005,CiE,1,0,Computability-Theoretic and Proof-Theoretic Aspects of Vaughtian Model Theory.
573697336e3b12023e623596,2010,CiE,1,0,Computable Ordered Abelian Groups and Fields.
573697336e3b12023e6235a3,2012,CiE,1,0,On Mathias Generic Sets.
573697336e3b12023e6235a4,2015,CiE,1,0,Local Compactness for Computable Polish Metric Spaces is \varPi ^1_1  1 1 -complete.
573697336e3b12023e6235a7,2011,CiE,1,0,Cupping and Diamond Embeddings: A Unifying Approach.
573697336e3b12023e6235bb,2013,CiE,1,0,Computing K-Trivial Sets by Incomplete Random Sets.
573697336e3b12023e6235c1,2012,CiE,1,0,How Much Randomness Is Needed for Statistics?
573697336e3b12023e6235e3,2010,CiE,1,0,Counting the Changes of Random D02 Sets.
573697336e3b12023e623601,2006,CiE,1,0,Degrees of Weakly Computable Reals.
573697336e3b12023e623620,2009,CiE,1,0,Notes on the Jump of a Structure.
573697336e3b12023e62364f,2006,CiE,1,0,On Graph Isomorphism for Restricted Graph Classes.
573697336e3b12023e623661,2009,CiE,1,0,Members of Random Closed Sets.
573697336e3b12023e623669,2005,CiE,1,0,Arthur-Merlin Games and the Problem of Isomorphism Testing.
573697336e3b12023e62367a,2012,CiE,1,0,"Randomness, Computation and Mathematics."
573697336e3b12023e62368e,2009,CiE,1,0,Lowness for Demuth Randomness.
573697336e3b12023e623697,2005,CiE,1,0,New Algorithmic Paradigms in Exponential Time Algorithms.
573697336e3b12023e6236ba,2007,CiE,1,0,Enumerations and Torsion Free Abelian Groups.
573697336e3b12023e6236c4,2007,CiE,1,0,Computability and Incomputability.
573697336e3b12023e6236c9,2011,CiE,1,0,Three Theorems on n-REA Degrees: Proof-Readers and Verifiers.
573697336e3b12023e6236da,2005,CiE,1,0,"Kripke Models, Distributive Lattices, and Medvedev Degrees."
573697336e3b12023e6236e3,2008,CiE,1,0,Computable Categoricity of Graphs with Finite Components.
573697336e3b12023e6236e6,2009,CiE,1,0,Numberings and Randomness.
573697336e3b12023e6236f8,2009,CiE,1,0,The First Order Theories of the Medvedev and Muchnik Lattices.
573697336e3b12023e623703,2007,CiE,1,0,Comparing C.E. Sets Based on Their Settling Times.
573697336e3b12023e623711,2010,CiE,1,0,The Strength of the Besicovitch-Davies Theorem.
573697336e3b12023e62372f,2009,CiE,1,0,"0""-Categorical Completely Decomposable Torsion-Free Abelian Groups."
573697336e3b12023e623743,2007,CiE,1,0,Pseudojump Operators and P01 Classes.
573697336e3b12023e62378d,2007,CiE,1,0,A Weakly 2-Random Set That Is Not Generalized Low.
573697336e3b12023e62379d,2014,CiE,1,0,On the Effectiveness of Symmetry Breaking.
573697336e3b12023e6237a1,2015,CiE,1,0,Nonexistence of Minimal Pairs in L[d].
573697336e3b12023e6237b6,2013,CiE,1,0,Real Benefit of Promises and Advice.
573697336e3b12023e6237c7,2012,CiE,1,0,Highness and Local Noncappability.
573697336e3b12023e6237ce,2013,CiE,1,0,Local Computability for Ordinals.
573697336e3b12023e6237e2,2015,CiE,1,0,Covering the Recursive Sets.
573697336e3b12023e6237f6,2013,CiE,1,0,The Classification Problem for Compact Computable Metric Spaces.
573697336e3b12023e6237f9,2009,CiE,1,0,The Strength of the Grtzer-Schmidt Theorem.
573697336e3b12023e623d83,2008,GRAPP,1,0,Embedding Multimedia Content Within Virtual Environments - The OGRE Approach.
573697336e3b12023e623ee2,2008,GRAPP,1,0,Presenting Interactive Multimedia Documents within Virtual Environments.
573697336e3b12023e623ff1,2010,EDBT/ICDT Workshops,1,0,An architecture for ad-hoc and collaborative business intelligence.
573697346e3b12023e624225,2008,COORDINATION,1,0,A Compositional Trace Semantics for Orc.
573697346e3b12023e6248a8,1997,SIROCCO,1,0,Better Expanders and Superconcentrators by Kolmogorov Complexity.
573697346e3b12023e624b9b,2008,ICON,1,0,Autonomous dynamic honeypot routing mechanism for mitigating DDoS attacks in DMZ.
573697346e3b12023e624bc1,2008,ICON,1,0,FTEP: A fault tolerant election protocol for multi-level clustering in homogeneous wireless sensor networks.
573697346e3b12023e624bd6,2008,ICON,1,0,Probability based routing for Ad Hoc networks in a building.
573697346e3b12023e624bd7,2008,ICON,1,0,CPN model for a Hierarchical Fault Tolerance Protocol for Mobile Agent systems.
573697346e3b12023e624be5,2008,ICON,1,0,FVBA: A combined statistical approach for low rate degrading and high bandwidth disruptive DDoS attacks detection in ISP domain.
573697346e3b12023e624c49,2008,ICON,1,0,Dual radio based cooperative caching for wireless sensor networks.
573697346e3b12023e624caf,2011,ICON,1,0,Performance evaluation of agent and non-agent based data dissemination protocols for wireless sensor networks.
573697346e3b12023e624d09,2008,ICON,1,0,Comparison of location management techniques for mobile agents.
573697366e3b12023e626a6f,2010,ICCSA (4),1,0,A Bidirectional Heuristic Search Technique for Web Service Composition.
573697366e3b12023e626f01,2015,ICCSA (Short Papers/poster papers/PhD student showcase works),1,0,Improving Link Ranking Quality by Quasi-Common Neighbourhood.
573697366e3b12023e626f09,2015,ICCSA (2),1,0,Modeling Socially Synergistic Behavior in Autonomous Agents.
573697366e3b12023e626f13,2009,ICCSA (1),1,0,Modeling Agents' Knowledge in Collective Evolutionary Systems.
573697376e3b12023e62732c,2012,ICCSA (3),1,0,A Framework for QoS Based Dynamic Web Services Composition.
573697376e3b12023e627549,2011,ICCSA (5),1,0,Performance Analysis of an Algorithm for Computation of Betweenness Centrality.
573697396e3b12023e6288fd,2004,International Conference on Internet Computing,1,0,TOP: A Transport Overlay Protocol for Peer-to-Peer Applications.
573697396e3b12023e628dc2,1996,EDCC,1,0,Friends - A Flexible Architecture for Implementing Fault Tolerant and Secure Distributed Applications.
5736973a6e3b12023e6292d8,2006,MIAR,1,0,An Improved 2D Colonic Polyp Segmentation Framework Based on Gradient Vector Flow Deformable Model.
5736973a6e3b12023e62978f,2013,SDL Forum,1,0,Static Analysis Techniques to Verify Mutual Exclusion Situations within SysML Models.
5736973a6e3b12023e629ae8,2010,STOC,1,0,Deterministic identity testing of depth-4 multilinear circuits with bounded top fan-in.
5736973a6e3b12023e629c56,2002,STOC,1,0,Reimer's inequality and tardos' conjecture.
5736973a6e3b12023e629dd9,1990,STOC,1,0,On Polynomial Time Bounded Truth-Table Reducibility of NP Sets to Sparse Sets
5736973a6e3b12023e62a0bf,1987,STOC,1,0,The Strong Exponential Hierarchy Collapses
5736973a6e3b12023e62a2f3,1982,STOC,1,0,"Trees, Automata, and Games"
5736973a6e3b12023e62a39a,2008,STOC,1,0,Fast integer multiplication using modular arithmetic.
5736973a6e3b12023e62a3bb,2010,STOC,1,0,On the hardness of the noncommutative determinant.
5736973a6e3b12023e62a50a,2011,STOC,1,0,Pseudorandom generators for group products: extended abstract.
5736973a6e3b12023e62a85c,2011,SocProS (2),1,0,Optimal Clustering Method Based on Genetic Algorithm.
5736973b6e3b12023e62affe,2009,FOGA,1,0,Computing single source shortest paths using single-objective fitness.
5736973b6e3b12023e62b4db,2000,KDD,1,0,Agglomerative clustering of a search engine query log.
5736973c6e3b12023e62bdd1,2013,Programming Logics,1,0,The Relative Power of Semantics and Unification.
5736973c6e3b12023e62c039,2004,Aspects of Molecular Computing,1,0,Plasmids to Solve #3SAT.
5736973c6e3b12023e62c08d,1997,"Advances in Algorithms, Languages, and Complexity",1,0,High Sets for NP.
5736973d6e3b12023e62c148,2012,The Multivariate Algorithmic Revolution and Beyond,1,0,The Birth and Early Years of Parameterized Complexity.
5736973d6e3b12023e62c243,1987,Computation Theory and Logic,1,0,Grammars for Terms and Automata - On a book by the late J. Richard Bchi.
5736973d6e3b12023e62c2aa,2012,The Multivariate Algorithmic Revolution and Beyond,1,0,A Basic Parameterized Complexity Primer.
5736973d6e3b12023e62c321,2012,"Computation, Physics and Beyond",1,0,Demuth's Path to Randomness.
5736973d6e3b12023e62c3cc,2012,"Computation, Physics and Beyond",1,0,Bounded Randomness.
5736973d6e3b12023e62c40b,2012,"Computation, Physics and Beyond",1,0,How Much Information Can There Be in a Real Number?
5736973d6e3b12023e62c40f,2016,A List of Successes That Can Change the World,1,0,The Recursive Union of Some Gradual Types.
5736973d6e3b12023e62c4bd,2002,The Essence of Computation,1,0,A Symmetric Approach to Compilation and Decompilation.
5736973d6e3b12023e62c77c,1987,Computation Theory and Logic,1,0,Minimal Pairs for Polynomial Time Reducibilities.
5736973d6e3b12023e62c7ad,1997,Foundations of Computer Science: Potential - Theory - Cognition,1,0,Computer Science as Cultural Development: Toward a Broader Theory.
5736973e6e3b12023e62d3ac,2006,MDM,1,0,Data Stream Query Optimization Across System Boundaries of Server and Sensor Network.
5736973e6e3b12023e62d404,2006,MDM,1,0,SOGOS - A Distributed Meta Level Architecture for the Self-Organizing Grid of Services.
5736973e6e3b12023e62d5ea,2006,MDM,1,0,Operator Allocation in Borealis with Integrated Sensor Network Query Processors.
5736973e6e3b12023e62d7c2,1972,International Sympoisum on Theoretical Programming,1,0,Configurable computers: a new class of general purpose machines.
5736973f6e3b12023e62dd98,1988,CAAP,1,0,On Counting and Approximation.
5736973f6e3b12023e62dff3,2001,IWDC,1,0,Towards a New Generation of Generic Transport Protocols.
5736973f6e3b12023e62e098,2005,IWDC,1,0,A Memory Efficient Fast Distributed Real Time Commit Protocol.
5736973f6e3b12023e62e0b0,2004,IWDC,1,0,Network Management System Using Web Server Controlled Mobile Agents.
5736973f6e3b12023e62e0b6,2005,IWDC,1,0,Efficient Mobility Management for Cache Invalidation in Wireless Mobile Environment.
5736973f6e3b12023e62e0d1,2005,IWDC,1,0,Planning in a Distributed System.
5736973f6e3b12023e62e0d2,2005,IWDC,1,0,Performance Comparison of Majority Voting with ROWA Replication Method over PlanetLab.
573697406e3b12023e62e54e,2015,Critical Infrastructure Protection,1,0,Industrial Control System Fingerprinting and Anomaly Detection.
573697416e3b12023e62f976,2011,VTC Fall,1,0,Car2X Communication: Securing the Last Meter - A Cost-Effective Approach for Ensuring Trust in Car2X Applications Using In-Vehicle Symmetric Cryptography.
573697416e3b12023e62fb7d,2011,VTC Fall,1,0,A Formal Methodology Applied to Secure Over-the-Air Automotive Applications.
